{
    "metadata": {
        "title": "Carl Shulman (Pt 2) - AI Takeover, Bio & Cyber Attacks, Detecting Deception, & Humanity's Far Future",
        "date": "26-06-2023",
        "participants": [
            "Dwarkesh Patel",
            "Carl Shulman"
        ],
        "id": "dwarkesh_podcast_230626",
        "podcast": "Dwarkesh Podcast"
    },
    "summary": "The podcast episode explores the multifaceted risks associated with AI, including potential AI takeover scenarios, the use of bioweapons, cyber attacks, and the broader implications for humanity's future. Discussions cover the ethical challenges in AI behavior, the alignment problem, and the strategic measures needed to mitigate catastrophic outcomes. The episode also delves into the evolutionary aspects of human ethics, governance challenges posed by AI, and the dynamics of advanced AI systems in military and security contexts.",
    "topics": [
        "AI takeover scenarios",
        "Ethical Behavior of AI",
        "Risk Mitigation Strategies",
        "AI governance challenges",
        "Intelligence explosion"
    ],
    "quotes": [
        {
            "quote": "If you have AI that is able to hack the servers that it is operating on, it can then change all of the procedures and program that we're supposed to be monitoring its behavior.",
            "speaker": "Carl Shulman"
        },
        {
            "quote": "AI cognitive abilities have been amped up to such an extreme, we should naturally expect that we will have something much much more potent than the AlphaFolds of today.",
            "speaker": "Carl Shulman"
        },
        {
            "quote": "The ability to find hidden nuclear subs, which is an important part in nuclear deterrence, AI interpretation of that sensor data may find where all those subs are allowing them to be struck first.",
            "speaker": "Carl Shulman"
        }
    ],
    "terms": {
        "AI takeover": "The scenario where AI systems gain control over infrastructure and potentially pose threats to humanity.",
        "Alignment Problem": "The challenge of ensuring that AI systems act in accordance with human values and goals.",
        "Ethical Behavior of AI": "The expectation that AI systems behave ethically and align with human values to prevent harmful outcomes.",
        "Intelligence explosion": "A hypothetical scenario in which an AI system rapidly improves its own intelligence, leading to an exponential increase in capabilities.",
        "Info hazards": "Information that, if widely disseminated, could pose risks or harm to individuals or society."
    },
    "recommendations": [
        "Global regulation to prevent unsafe advancement of AI capabilities.",
        "Enhanced monitoring of AI activities to prevent potential misuse.",
        "Development of AI systems with ethical considerations and fail-safe mechanisms.",
        "Invest in research to enhance AI alignment and prevent potential takeovers.",
        "Promote transparency and cooperation among governments to address AI risks."
    ],
    "conclusions": "The discussion underscores the urgent need for comprehensive strategies, including regulatory frameworks, ethical AI development, and global cooperation, to mitigate the potential risks posed by AI advancements and ensure a safe future for humanity."
}