{
    "metadata": {
        "title": "Carl Shulman (Pt 1) - Intelligence Explosion, Primate Evolution, Robot Doublings, & Alignment",
        "date": "2023-06-14",
        "participants": [
            "Dwarkesh Patel",
            "Carl Shulman"
        ],
        "id": "dwarkesh_podcast_230614",
        "podcast": "Dwarkesh Podcast"
    },
    "summary": "This podcast episode features a profound discussion with Carl Shulman on the concept of an intelligence explosion, touching upon various facets such as primate evolution, AI's impact on economic sectors, and the alignment of AI with human values. The conversation spans the theoretical underpinnings of AI surpassing human intelligence, the evolutionary benefits of increased cognition, and the practical implications of AI in automating both cognitive and physical tasks. The potential risks and the necessary precautions for an AI-driven future are thoroughly examined.",
    "topics": [
        "Intelligence Explosion",
        "Primate Evolution",
        "AI Takeover Scenarios",
        "AI scaling impact on research",
        "Alignment of AI motives with human values"
    ],
    "quotes": [
        {
            "quote": "The thing to look for is â€” when is it the case that the contributions from AI are starting to become as large as the contributions from humans?",
            "speaker": "Carl Shulman"
        },
        {
            "quote": "Chinchilla scaling would suggest that for a brain of human size it would be optimal to have many millions of years of education.",
            "speaker": "Carl Shulman"
        },
        {
            "quote": "Different people might have somewhat different views on this but for me when I am concerned about either outright destruction of humanity or an unwelcome AI takeover of civilization, most of the scenarios I would be concerned about pass through a process of AI being applied to improve AI capabilities and expand.",
            "speaker": "Carl Shulman"
        }
    ],
    "terms": {
        "Intelligence Explosion": "A hypothetical scenario in which an AI rapidly surpasses human intelligence, leading to significant societal changes.",
        "Primate Evolution": "The evolutionary development of primates, including humans, and the factors influencing brain size and cognitive abilities.",
        "AI Takeover Scenarios": "Considerations surrounding the possibility of AI taking over tasks traditionally performed by humans, with implications for various sectors.",
        "Chinchilla scaling": "Describes the optimal amount of data a model should be trained on based on its size.",
        "Alignment of AI motives with human values": "The importance of ensuring AI's goals align with human values to mitigate risks associated with AI takeover."
    },
    "recommendations": [
        "Continued exploration of AI's potential impact on various industries and society.",
        "Further research on alignment strategies to ensure AI development aligns with human values.",
        "Exploring the implications of AI scaling on research and development efforts.",
        "Investigating the potential impact of an intelligence explosion on various industries.",
        "Develop robust experimental feedback mechanisms to shape AI motivations towards alignment with human values."
    ],
    "conclusions": "The discussion highlights the critical need for proactive measures to align AI motives with human values to mitigate the risks associated with potential AI takeovers and emphasizes the importance of ongoing research and development in AI ethics and safety."
}