{
    "metadata": {
        "title": "Nat Friedman - Reading Ancient Scrolls, Open Source, & AI",
        "date": "22-03-2023",
        "participants": [
            "Nat Friedman",
            "Dwarkesh Patel"
        ],
        "id": "dwarkesh_podcast_230322",
        "podcast": "Dwarkesh Podcast"
    },
    "summary": "This podcast episode explores Nat Friedman's various initiatives, including the innovative Vesuvius Challenge to interpret ancient scrolls, the strategic acquisition of GitHub by Microsoft, and the pivotal role of open source in the AI sector. It also covers the development journey of AI models like GPT-3, the creation and evolution of Co-pilot, and the broader impacts these have on developer empowerment and product development within tech organizations.",
    "topics": [
        "Reading Ancient Scrolls",
        "Open Source in AI",
        "GitHub Acquisition",
        "Origin story of Co-pilot",
        "Evolution of AI models"
    ],
    "quotes": [
        {
            "quote": "The challenge that we have is there's an entire new generation of developers who have no affinity with Microsoft and the largest collection of them is at GitHub.",
            "speaker": "Nat Friedman"
        },
        {
            "quote": "I think the value of a company boils down to its cultural ability to produce new innovations and there is some sensitive harmonic of cultural elements that sets that up to make that possible.",
            "speaker": "Nat Friedman"
        },
        {
            "quote": "GPT-3 came out in May of 2020. I saw it and it really blew my mind.",
            "speaker": "Nat Friedman"
        }
    ],
    "terms": {
        "Open Source": "A development model that promotes universal access via a free license to a product's design or blueprint, and allows for enhancements and modifications by anyone.",
        "Machine Learning Models": "Algorithms that enable computers to learn from and make predictions or decisions based on data without being explicitly programmed.",
        "Co-pilot": "A widely used application of modern AI models",
        "GPT-3": "Generative Pre-trained Transformer 3, an advanced AI language model",
        "Alignment": "Ensuring AI systems act in accordance with human values and intentions"
    },
    "recommendations": [
        "To focus on developer priorities to earn trust and credibility.",
        "To maintain the independence and community focus of acquired companies.",
        "To address cultural differences and protect the innovative culture of acquired companies.",
        "Invest in technical alignment solutions in the AI field",
        "Encourage open source development of AI alignment tools"
    ],
    "conclusions": "The podcast episode provides insights into the evolution and impact of AI models like Co-pilot, the challenges and advancements in product development, the importance of technical alignment in AI, and the potential for open source contributions to shape the future of AI technology."
}