{
    "metadata": {
        "title": "Mark Zuckerberg - Llama 3, Open Sourcing $10b Models, & Caesar Augustus",
        "date": "18-04-2024",
        "participants": [
            "Mark Zuckerberg",
            "Dwarkesh Patel"
        ],
        "id": "dwarkesh_podcast_240418",
        "podcast": "Dwarkesh Podcast"
    },
    "summary": "In this podcast episode, Mark Zuckerberg and Dwarkesh Patel engage in a detailed discussion on the latest advancements and ethical considerations in artificial intelligence, focusing on the rollout of Llama-3, the challenges and implications of open-sourcing AI models, and the broader impacts of AI on society. They explore the potential of AI to transform technology and human interaction, while also addressing the risks and necessary precautions to ensure safe, equitable, and effective deployment.",
    "topics": [
        "Llama-3",
        "Open sourcing AI models",
        "Ethical Considerations in AI Development",
        "$10b models",
        "Intelligence explosion"
    ],
    "quotes": [
        {
            "quote": "We're rolling out Llama-3. We're doing it both as open source for the dev community and it is now going to be powering Meta AI.",
            "speaker": "Mark Zuckerberg"
        },
        {
            "quote": "I think it's going to be more like the creation of computing in the first place. You'll get all these new apps in the same way as when you got the web or you got mobile phones.",
            "speaker": "Mark Zuckerberg"
        },
        {
            "quote": "I think another bias that people tend to have is thinking that intelligence is somehow fundamentally connected to life.",
            "speaker": "Mark Zuckerberg"
        }
    ],
    "terms": {
        "Llama-3": "The latest AI model being rolled out by Meta AI, available as open source and designed to be the most intelligent AI assistant.",
        "AGI": "Artificial General Intelligence, referring to AI systems that can understand and learn any intellectual task that a human being can.",
        "Multimodality": "The ability of AI models to process and generate information across multiple modalities like text, images, and videos.",
        "Ethical AI": "Ensuring AI systems operate fairly, transparently, and without bias.",
        "Open Source": "Software with source code that anyone can inspect, modify, and enhance."
    },
    "recommendations": [
        "Invest in building infrastructure to support AI advancements.",
        "Consider energy constraints and regulations for scaling AI models.",
        "Explore the potential of AI in various industries and applications.",
        "Evaluate potential risks of open-sourcing AI models",
        "Maintain focus on mitigating current AI-related harms"
    ],
    "conclusions": "AI development, particularly in the context of models like Llama-3 and future iterations, is expected to fundamentally change various industries and human experiences, akin to the advent of computing technologies. Balancing the benefits of open-source AI with the need for ethical oversight and responsible deployment is crucial for the future of technology."
}