{
    "metadata": {
        "title": "Holden Karnofsky - Transformative AI & Most Important Century",
        "date": "03-01-2023",
        "participants": [
            "Holden Karnofsky",
            "Dwarkesh Patel"
        ],
        "id": "dwarkesh_podcast_230103",
        "podcast": "Dwarkesh Podcast"
    },
    "summary": "This podcast episode, featuring Holden Karnofsky, explores the profound implications of transformative AI on humanity, focusing on the acceleration of economic growth, the alignment of AI with human values, and the ethical considerations necessary for shaping a positive future. The discussion delves into the potential risks and benefits of AI, the concept of lock-in scenarios, and the importance of a Bayesian mindset in decision-making, underscoring the urgency and significance of this century in the context of technological advancements.",
    "topics": [
        "The Most Important Century",
        "Transformative AI",
        "AI Alignment",
        "Ethical considerations in decision-making",
        "Risk Assessment"
    ],
    "quotes": [
        {
            "quote": "If we developed the right kind of AI systems this century, this could make this century the most important of all time for humanity.",
            "speaker": "Holden Karnofsky"
        },
        {
            "quote": "There are opportunities to spend money and get an enormous impact because you're doing something very important thatâ€™s being ignored by others.",
            "speaker": "Holden Karnofsky"
        },
        {
            "quote": "I think the situation looks very challenging, very scary by default, and I think we're tending to overestimate how bad and how dire things are.",
            "speaker": "Holden Karnofsky"
        }
    ],
    "terms": {
        "Transformative AI": "AI systems that can do all key tasks humans do to advance science and technology, potentially leading to rapid progress and significant changes.",
        "Most Important Century": "The hypothesis that developing transformative AI this century could lead to significant advancements and shape the future of humanity.",
        "AI Alignment": "The process of ensuring that artificial intelligence systems act in accordance with human values and goals.",
        "Lock-in": "A scenario where a stable state is reached in a system, potentially leading to limited future dynamism or flexibility.",
        "Bayesian mindset": "A way of thinking that involves assigning probabilities to beliefs and using these probabilities to update and make decisions based on new evidence."
    },
    "recommendations": [
        "Invest in research and development to shape the future of AI responsibly.",
        "Prioritize identifying and addressing potential risks associated with AI advancements.",
        "Encourage discussions on ethics and rights in a future world with advanced AI systems.",
        "Focus on AI alignment research to mitigate risks associated with advanced AI technologies.",
        "Consider the implications of transformative AI on future societal and technological developments."
    ],
    "conclusions": "The podcast underscores the critical need for proactive and thoughtful engagement with the challenges and opportunities presented by transformative AI, emphasizing the essential role of ethical considerations, risk assessment, and alignment with human values to ensure that AI advancements contribute positively to the future of humanity."
}