{
    "metadata": {
        "id": "dwarkesh_podcast_240221",
        "podcast": "Dwarkesh Podcast",
        "title": "Patrick Collison (Stripe CEO) - Craft, Beauty, & The Future of Payments",
        "date": "21-02-2024",
        "participants": [
            "Patrick Collison",
            "Dwarkesh Patel"
        ]
    },
    "summary": "The podcast episode with Patrick Collison, CEO of Stripe, explores the expansive role of Stripe in the digital economy, touching on its handling of substantial financial volumes, its future, and the broader implications of its work on the tech and financial sectors, including AI and big business virtues.",
    "topics": [
        "Future of Stripe",
        "Financial infrastructure for AI agents",
        "Reliability and scalability in tech infrastructure",
        "Virtues of big businesses",
        "Collaborative partnerships in business ventures"
    ],
    "quotes": [
        {
            "quote": "The adaptability premium is probably going to go way up over the next decade.",
            "speaker": "Patrick Collison"
        },
        {
            "quote": "One should model organizations as if they're run by a cabal of their enemies.",
            "speaker": "Patrick Collison"
        },
        {
            "quote": "People tend to have very positive sentiments towards startups, but established businesses contribute a significant share of innovation.",
            "speaker": "Dwarkesh Patel"
        }
    ],
    "terms": {
        "Stripe": "A technology company that allows businesses to accept payments over the Internet.",
        "APIs": "Application Programming Interfaces, which allow different software applications to communicate with each other.",
        "Arc Institute": "A biomedical research organization focused on advancing scientific research and innovation.",
        "AI": "Artificial Intelligence, the simulation of human intelligence processes by machines.",
        "Moats": "Factors that give a company competitive advantages over others."
    },
    "recommendations": [
        "Consider the adaptability premium in the upcoming decade.",
        "Model organizations as if they are run by their enemies for better decision-making.",
        "Invest in tech infrastructure for reliability and scalability to support economic activities.",
        "Explore the financial infrastructure for AI agents.",
        "Encourage partnerships with close associates for effective and fulfilling business ventures"
    ],
    "conclusions": "The podcast episode underscores the critical importance of adaptability, strategic organizational modeling, and the power of partnerships in fostering innovation and growth in the digital economy, with Stripe positioned as a key player in shaping future financial and technological infrastructures."
}