{
    "metadata": {
        "id": "dwarkesh_podcast_240131",
        "podcast": "Dwarkesh Podcast",
        "title": "Tyler Cowen - Hayek, Keynes, & Smith on AI, Animal Spirits, Anarchy, & Growth",
        "date": "31-01-2024",
        "participants": [
            "Dwarkesh Patel",
            "Tyler Cowen"
        ]
    },
    "summary": "This podcast episode with Tyler Cowen and Dwarkesh Patel delves into the perspectives of Hayek, Keynes, and Smith on the role of AI in economic systems, discussing concepts like growth, risk, and human nature. The discussion explores various economic theories, the impact of AI on markets and societal structures, and the balance between central planning and decentralized order. The implications of AI advancements in replicating markets, evolving currencies, and influencing global economic dynamics are also examined, alongside the potential of emerging technologies like Web 3.0 and crypto.",
    "topics": [
        "Insights of Hayek, Keynes, and Smith",
        "AI, growth, risk, human nature",
        "Anarchy and central planning",
        "Decentralization and scientism in economic systems",
        "AI Advancements"
    ],
    "quotes": [
        {
            "quote": "Well, the market’s not solving for a general equilibrium. It’s just solving for something that gets us into the next day.",
            "speaker": "Tyler Cowen"
        },
        {
            "quote": "They're going to replicate markets on their own, has been my prediction, and I think they're going to evolve their own currencies.",
            "speaker": "Tyler Cowen"
        },
        {
            "quote": "You could say it’s my argument against anarchy, and it is an argument against anarchy, but it’s also an argument that says anarchy is everywhere.",
            "speaker": "Tyler Cowen"
        }
    ],
    "terms": {
        "General Equilibrium": "A state in which economic forces such as supply and demand are balanced and in the absence of external influences, prices remain constant.",
        "Decentralization": "The dispersal of decision-making authority to multiple levels of an organization or system.",
        "AI agents": "Artificial intelligence entities capable of autonomous decision-making and interaction.",
        "Anarchy": "Absence of government and absolute freedom of the individual.",
        "Web 3.0": "The third stage of development of the internet, marked by the creation of a more connected, open, and intelligent web, often associated with blockchain and decentralized technologies."
    },
    "recommendations": [
        "Consider the balance between decentralization and scientism in decision-making processes.",
        "Evaluate the role of competition in fostering innovation and driving economic progress.",
        "Explore the challenges and benefits of central planning in various economic contexts.",
        "Stop taxing savings to encourage long-term financial planning.",
        "Explore targeted ways to subsidize savings for low-income individuals."
    ],
    "conclusions": "The discussion highlights the complex interplay between AI advancements, economic theories, and societal implications. It underscores the need for innovative approaches to address evolving economic challenges, particularly in the context of emerging technologies like AI."
}