{
    "metadata": {
        "title": "Sholto Douglas & Trenton Bricken - How to Build & Understand GPT-7's Mind",
        "date": "28-03-2024",
        "participants": [
            "Dwarkesh Patel",
            "Sholto Douglas",
            "Trenton Bricken"
        ],
        "id": "dwarkesh_podcast_240328",
        "podcast": "Dwarkesh Podcast"
    },
    "summary": "This podcast episode provides an in-depth discussion on the development and understanding of large language models like GPT-7, focusing on aspects such as training complexities, AI interpretability, and the impact of compute resources. The participants explore various challenges in AI research, the importance of empirical studies, and strategies for optimizing research efficiency. Key topics include the role of in-context learning, intelligence explosion, and the intricacies of model behavior and feature representation.",
    "topics": [
        "Training Large Language Models",
        "AI Interpretability",
        "Compute Resources",
        "Feature Representation",
        "Model Scaling"
    ],
    "quotes": [
        {
            "quote": "I think it's really underhyped. Until I started working on it, I didn't really appreciate how much of a step up in intelligence it was for the model to have the onboarding problem basically instantly solved.",
            "speaker": "Sholto Douglas"
        },
        {
            "quote": "Most intelligence is pattern matching... I think there are general features that you can pick up and then apply in novel circumstances.",
            "speaker": "Trenton Bricken"
        },
        {
            "quote": "By far the best researchers I've seen, they all have the ability to try experiments really, really, really, really, really fast.",
            "speaker": "Trenton Bricken"
        }
    ],
    "terms": {
        "LLMs": "Large Language Models, such as GPT-7, are advanced AI models trained on vast amounts of text data for natural language processing tasks.",
        "In-Context Learning": "Refers to a model's ability to learn and reason within a specific context, improving performance on tasks requiring contextual understanding.",
        "Compute Resources": "The computational power required for training and running AI models, often a limiting factor in scaling AI research.",
        "Feature Representation": "A direction in activation space with causal influence, crucial for understanding how AI models process and interpret data.",
        "Model Scaling": "The practice of increasing the size and complexity of AI models for improved performance."
    },
    "recommendations": [
        "Focus on understanding and interpreting model behavior to enhance AI research outcomes.",
        "Invest in compute power for enhanced research capabilities.",
        "Optimize cycle time for faster experimentation and progress.",
        "Use dictionary learning to identify triggers and behaviors in AI models.",
        "Employ fine-tuning techniques to detect malicious behavior in models."
    ],
    "conclusions": "The podcast underscores the complexities and necessities of advancing AI research, particularly in understanding and developing large language models like GPT-7. It stresses the importance of empirical research, the strategic use of compute resources, and the critical need for interpretability to manage and harness AI capabilities effectively."
}