{
    "metadata": {
        "title": "Dario Amodei (Anthropic CEO) - Scaling, Alignment, & AI Progress",
        "date": "08-08-2023",
        "participants": [
            "Dwarkesh Patel",
            "Dario Amodei"
        ],
        "id": "dwarkesh_podcast_230808",
        "podcast": "Dwarkesh Podcast"
    },
    "summary": "This podcast episode features Dario Amodei, CEO of Anthropic, discussing critical aspects of AI development such as scaling, alignment, and the progression of AI technologies. The conversation covers the empirical nature of scaling in AI, the challenges of predicting specific capabilities, the complexities in achieving alignment at scale, and the implications for AI safety and model control. The discussions also touch on the broader implications of AI technologies, including cybersecurity, the need for mechanistic interpretability, and the strategies for handling the potential risks of AGI.",
    "topics": [
        "Scaling in AI models",
        "Alignment and values in AI",
        "AI Safety",
        "Mechanistic interpretability",
        "Model Scaling"
    ],
    "quotes": [
        {
            "quote": "The truth is that we still don't know. It's almost entirely an empirical fact.",
            "speaker": "Dario Amodei"
        },
        {
            "quote": "We're already at the point where if you look at the loss, the scaling laws are starting to bend.",
            "speaker": "Dario Amodei"
        },
        {
            "quote": "The models do display a kind of ordinary creativity. There is some creativity to that and they do draw new connections of the kind that an ordinary person would draw.",
            "speaker": "Dario Amodei"
        }
    ],
    "terms": {
        "scaling": "The empirical phenomenon of AI models improving predictably with increased parameters and data.",
        "alignment": "The challenge of ensuring AI systems act in accordance with human values and goals.",
        "loss function": "A function that quantifies the difference between predicted and actual values during model training.",
        "AGI": "Artificial General Intelligence, referring to AI systems that can perform any intellectual task that a human can do.",
        "Mechanistic Interpretability": "Understanding AI decision-making processes at a detailed level for transparency and safety measures."
    },
    "recommendations": [
        "Exploring alternative loss functions for AI training.",
        "Investigating reinforcement learning for enhancing AI capabilities.",
        "Enhance focus on cybersecurity measures to prevent potential threats.",
        "Invest in research on mechanistic interpretability for better AI understanding.",
        "Strengthen alignment methods to mitigate risks associated with AI development."
    ],
    "conclusions": "The podcast underscores the importance of continuous research in AI scaling, alignment, and safety to navigate the complexities of advanced AI development and ensure responsible usage. Dario Amodei emphasizes the need for a nuanced understanding of AI capabilities and the proactive measures required to mitigate potential risks associated with AI technologies."
}