{
    "metadata": {
        "title": "Demis Hassabis - Scaling, Superhuman AIs, AlphaZero atop LLMs, Rogue Nations Threat",
        "date": "28-02-2024",
        "participants": [
            "Dwarkesh Patel",
            "Demis Hassabis"
        ],
        "id": "dwarkesh_podcast_240228",
        "podcast": "Dwarkesh Podcast"
    },
    "summary": "This podcast episode features an in-depth conversation between Dwarkesh Patel and Demis Hassabis, CEO of Google DeepMind. They discuss the intricacies of AI development, focusing on the theoretical and practical aspects of intelligence, the integration of reinforcement learning with Large Language Models, and the strategic scaling and alignment of AI systems. They also explore the timelines for achieving Artificial General Intelligence and its associated risks, emphasizing the necessity for responsible innovation and broad collaboration in AI research.",
    "topics": [
        "Nature of intelligence",
        "Reinforcement learning atop LLMs",
        "Scaling and alignment",
        "AGI Progress",
        "Collaboration in AI Research"
    ],
    "quotes": [
        {
            "quote": "Intelligence is so broad and what we use it for is so generally applicable. I think that suggests there must be high-level common algorithmic themes around how the brain processes the world around us.",
            "speaker": "Demis Hassabis"
        },
        {
            "quote": "We’ve got to carry on improving the large models... On top of that, we’re working on things like AlphaZero-like planning mechanisms on top that make use of that model in order to make concrete plans to achieve certain goals in the world.",
            "speaker": "Demis Hassabis"
        },
        {
            "quote": "I think it’s much bigger than any one company or even industry in general. I think it has to be a big collaboration with many stakeholders from civil society, academia, government, etc.",
            "speaker": "Demis Hassabis"
        }
    ],
    "terms": {
        "AGI": "Artificial General Intelligence, referring to AI systems that can understand, learn, and apply knowledge in a manner similar to human intelligence.",
        "LLMs": "Large Language Models, advanced AI models trained on vast amounts of text data to perform natural language processing tasks.",
        "RL": "Reinforcement Learning, a type of machine learning where an agent learns to make decisions by interacting with an environment and receiving rewards for correct actions."
    },
    "recommendations": [
        "Develop stringent evaluation systems for AI to prevent undesirable behaviors.",
        "Utilize narrow AI tools to analyze and summarize the actions of more general AI systems.",
        "Create secure sandbox simulations for AI experimentation to ensure safety and control.",
        "Collaborate with various stakeholders for responsible AI development",
        "Prioritize cautious optimism and thoughtful progress in AI innovation"
    ],
    "conclusions": "The podcast delves into the complexities of AI development, emphasizing the need for a balanced approach of scaling models and innovation, understanding the risks associated with AGI, and implementing stringent evaluation mechanisms for safe AI advancement."
}