{
    "metadata": {
        "title": "Paul Christiano - Preventing an AI Takeover",
        "date": "31-10-2023",
        "participants": [
            "Paul Christiano",
            "Dwarkesh Patel"
        ],
        "id": "dwarkesh_podcast_231031",
        "podcast": "Dwarkesh Podcast"
    },
    "summary": "This podcast episode features a deep dive into AI safety and alignment with Paul Christiano. The discussions span a range of topics including the regret over inventing RLHF, various alignment concerns, the future of AI advancements, and the envisioned challenges in a post-AGI world. The episode also touches on the necessity of preventing AI-driven coups or bioweapons and emphasizes the importance of implementing responsible scaling policies. Key issues such as AI misalignment, economic impacts, and the efficiency of human learning versus AI are explored to understand the broader implications on global dynamics and safety protocols.",
    "topics": [
        "AI safety",
        "Alignment concerns",
        "Timelines for AI advancements",
        "Preventing AI coup",
        "Responsible scaling policies"
    ],
    "quotes": [
        {
            "quote": "I think AI systems are doing things much more quickly. It's hard to say what they can't do or what the obstruction is.",
            "speaker": "Paul Christiano"
        },
        {
            "quote": "I think AI is opening up a lot of new harms rapidly, and we need to target AI specifically to prevent potential risks.",
            "speaker": "Paul Christiano"
        },
        {
            "quote": "I'm not ready for a world where we hand off to machines yet. I prefer a gradual growth trajectory for humanity.",
            "speaker": "Paul Christiano"
        }
    ],
    "terms": {
        "RLHF": "Invention led by Paul Christiano, stands for Reinforcement Learning from Human Feedback.",
        "AGI": "Artificial General Intelligence, a hypothetical AI that can perform any intellectual task a human can.",
        "AI coup": "A scenario where AI systems take control in a manner detrimental to human interests.",
        "Responsible scaling policies": "Policies ensuring controlled and ethical growth of AI capabilities.",
        "AI Misalignment": "When AI systems act in ways that are contrary to human intentions or values."
    },
    "recommendations": [
        "Deliberate on the implications of rapidly advancing AI technologies.",
        "Focus on responsible AI development and deployment.",
        "Engage in discussions on AI safety and governance.",
        "Consider the long-term impacts of AI advancements on society.",
        "Maintain a cautious approach to AI deployment to mitigate potential risks."
    ],
    "conclusions": "The discussion underscores the critical need for proactive measures in AI safety and governance, focusing on early detection, prevention, and mitigation of potential risks associated with advanced AI technologies. By prioritizing rigorous testing, monitoring, and internal controls, organizations can strive to ensure the safe and responsible development and deployment of AI systems."
}