{
    "metadata": {
        "title": "Supervise the Process of AI Research",
        "date": "2023-10-12",
        "participants": [
            "Jungwon Byun",
            "Andreas Stuhlmüller"
        ],
        "id": "latent_space_240411",
        "podcast": "Latent Space"
    },
    "summary": "The podcast episode extensively covers the necessity of supervising not just the outcomes but the entire process of AI research. It explores how innovations like Elicit are transforming academic research by redefining traditional tools and workflows, ensuring they are systematic, transparent, and unbounded. The discussions also delve into the challenges and advancements in NLP model performance, the implications of training data quality, and the broader impacts of multimodality and computational notebooks in research methodologies.",
    "topics": [
        "Supervising AI research processes",
        "Revolutionizing academic research with Elicit",
        "Training Data Quality",
        "New NLP Models",
        "Computational Notebooks"
    ],
    "quotes": [
        {
            "quote": "Ultimately, the goal is to actually build tools that help people reason more clearly, ask and answer better questions and make better decisions.",
            "speaker": "Andreas Stuhlmüller"
        },
        {
            "quote": "The thing that always motivated us is imagining a world where high quality reasoning is really abundant and AI is a technology that's going to get us there.",
            "speaker": "Jungwon Byun"
        },
        {
            "quote": "We really want the models to earn their right to the expertise... But I think that's where making sure that the model's processes are really explicit and transparent and that it's really easy to evaluate is important.",
            "speaker": "Jungwon Byun"
        }
    ],
    "terms": {
        "Elicit": "A tool aimed at reinventing academic research by providing a platform that enhances systematic and transparent research workflows.",
        "Computational Notebooks": "Interactive digital notebooks that allow researchers to combine software code, computational output, explanatory text, and multimedia resources in a single document.",
        "NLP": "Natural Language Processing, a branch of AI that deals with the interaction between computers and humans through natural language."
    },
    "recommendations": [
        "Focus on building tools that enhance reasoning and decision-making.",
        "Prioritize understanding the truth for economic and societal benefits.",
        "Emphasize systematic and transparent research workflows.",
        "Consider the importance of training data quality for model performance.",
        "Explore new NLP models like Claude Haiku and GPT-4 for various tasks."
    ],
    "conclusions": "The podcast episode highlights the critical need for systematic and transparent research facilitated by AI models. It emphasizes the importance of intentional participation in building applications that align with positive impacts on society."
}