{
    "metadata": {
        "title": "Eliezer Yudkowsky - Why AI Will Kill Us, Aligning LLMs, Nature of Intelligence, SciFi, & Rationality",
        "date": "06-04-2023",
        "participants": [
            "Eliezer Yudkowsky",
            "Dwarkesh Patel"
        ],
        "id": "dwarkesh_podcast_230406",
        "podcast": "Dwarkesh Podcast"
    },
    "summary": "In this podcast episode, Eliezer Yudkowsky and Dwarkesh Patel engage in a comprehensive discussion about the potential existential risks posed by AI, the critical importance of aligning large language models (LLMs) with human values, and the broader implications of AI on society and future technologies. They explore themes from science fiction to rationality, emphasizing the need for enhanced understanding and strategic approaches to AI development and alignment to prevent undesirable outcomes.",
    "topics": [
        "AI risks",
        "Aligning LLMs",
        "Future of AI",
        "Rationality in AI development",
        "Societal response to AI risks"
    ],
    "quotes": [
        {
            "quote": "Alignment will not be solved in a few years. I would hope for something along the lines of human intelligence enhancement works.",
            "speaker": "Eliezer Yudkowsky"
        },
        {
            "quote": "The smarter you are, the more out of distribution you get. Because as you get smarter, you get new options that are further from the options that you are faced with in the ancestral environment that you were optimized over.",
            "speaker": "Eliezer Yudkowsky"
        },
        {
            "quote": "The problem is that algorithms are continuing to improve. So you need to either shut down the journals reporting the AI results, or you need less and less and less computing power around.",
            "speaker": "Eliezer Yudkowsky"
        }
    ],
    "terms": {
        "LLMs": "Large Language Models (LLMs) are advanced AI models trained on vast amounts of text data to generate human-like text.",
        "Alignment": "The process of ensuring that AI systems act in accordance with human values and goals.",
        "AGI": "Artificial General Intelligence (AGI) refers to AI systems with the ability to understand, learn, and apply knowledge across diverse tasks.",
        "RLHF": "Reinforcement Learning from Human Feedback (RLHF) is a method where AI systems learn from human input to improve their decision-making."
    },
    "recommendations": [
        "Consider the implications of AI advancements on society and ethics.",
        "Focus on human intelligence enhancement as a potential solution to AI risks.",
        "Prioritize alignment research to ensure AI systems align with human values.",
        "Enhance transparency and understanding in AI development.",
        "Encourage global cooperation to address AI safety concerns."
    ],
    "conclusions": "The discussion underscores the critical need for proactive measures in AI safety and alignment, drawing parallels with historical challenges like nuclear weapons control. It highlights the importance of understanding AI's potential impacts and ensuring that future developments in AI technology are aligned with human values and societal well-being."
}