{
    "metadata": {
        "title": "Latent Space Chats: NLW (Four Wars, GPT5), Josh Albrecht/Ali Rohde (TNAI), Dylan Patel/Semianalysis (Groq), Milind Naphade (Nvidia GTC), Personal AI (ft. Harrison Chase â€” LangFriend/LangMem)",
        "date": "06-04-2024",
        "participants": [
            "NLW",
            "Josh Albrecht",
            "Ali Rohde",
            "Dylan Patel",
            "Milind Naphade",
            "Harrison Chase"
        ],
        "id": "latent_space_240406",
        "podcast": "Latent Space"
    },
    "summary": "This podcast episode explores a wide range of topics surrounding AI engineering, from the evolving role of AI engineers and the impact of big tech companies in the AI race to the challenges of AI hardware innovation and the strategic importance of data. The discussions provide a deep dive into the current and future landscape of AI technology, highlighting the significance of new AI models, data wars, and the necessity for robust AI engineering infrastructure.",
    "topics": [
        "AI engineering trends",
        "Big Tech Wars",
        "Data Wars",
        "AI-generated code",
        "AI hardware shortages"
    ],
    "quotes": [
        {
            "quote": "The AI engineer is the software engineer building with AI, enhanced by AI, and eventually it will be non-human engineers writing code for you.",
            "speaker": "swyx"
        },
        {
            "quote": "The NVIDIA GPU shortage obviously is going to be rectified. And when it is everyone's sort of double orders will become extremely apparent.",
            "speaker": "Dylan Patel"
        },
        {
            "quote": "Every agent needs a sandbox. If you're a code agent, you need a coding sandbox. If you have a model of the real world, you have to go generate some plan or some code or some test it against that real world.",
            "speaker": "swyx"
        }
    ],
    "terms": {
        "AI engineer": "A specialized role focusing on building AI-specific software, distinct from ML engineers and software engineers.",
        "Big Tech Wars": "Explores the strategies of major tech companies like Microsoft, Apple, Google, and Meta in the AI domain.",
        "Data Wars": "Highlights the importance of data sourcing, synthetic data, and challenges in data acquisition.",
        "AI-generated code": "Code that is created by AI systems, which can potentially increase development efficiency but also presents unique challenges and quality concerns.",
        "AI hardware shortages": "Refers to the current scarcity of essential hardware components like GPUs, which impacts the production and development of AI technologies."
    },
    "recommendations": [
        "Invest in specialized infrastructure to support AI development.",
        "Promote collaboration between human developers and AI engineers for enhanced productivity.",
        "Continue monitoring the AI hardware landscape for emerging trends.",
        "Focus on generating high-quality tests for AI-generated code.",
        "Consider the economic dynamics behind AI hardware shortages and chip supply chains."
    ],
    "conclusions": "The discussion underscores the rapid evolution of the AI landscape, emphasizing the critical role of AI engineering in shaping future technologies. It highlights the need for continued innovation, robust infrastructure, and strategic planning to address the challenges and opportunities presented by AI advancements."
}